CVE ID,src txt,attack vector1,attack vector2,value
CVE-2023-33973,"RIOT-OS, an operating system for Internet of Things (IoT) devices, contains a network stack with the ability to process 6LoWPAN frames. In versions 2023.01 and prior, an attacker can send a crafted frame which is forwarded by the device. During encoding of the packet a NULL pointer dereference occurs. This crashes the device leading to denial of service. A patch is available at pull request 19678. There are no known workarounds.",send a crafted frame which is forwarded by the device,send a crafted frame which is forwarded by the device,1
,RIOT-OS. <= 2023.01. RIOT-OS contains a network stack with the ability to process 6LoWPAN frames. An attacker can send a crafted frame which is forwarded by the device. During encoding of the packet a NULL pointer dereference occurs. This crashes the device leading to denial of service.,send a crafted frame which is forwarded by the device,,
CVE-2018-8531,"A remote code execution vulnerability exists in the way that Azure IoT Hub Device Client SDK using MQTT protocol accesses objects in memory, aka ""Azure IoT Device Client SDK Memory Corruption Vulnerability."" This affects Hub Device Client SDK, Azure IoT Edge.",,,
,"A remote code execution vulnerability exists in the way that Azure IoT Hub Device Client SDK using MQTT protocol accesses objects in memory. The vulnerability could corrupt memory in a way that could allow an attacker to execute arbitrary code in the context of the current user. An attacker who successfully exploited the vulnerability could gain the same user rights as the current user. If the current user is logged on with administrative user rights, the attacker could take control of an affected system. An attacker could then install programs; view, change, or delete data; or create new accounts with full user rights.

An attacker would have no way to force users to view the attacker-controlled content. Instead, an attacker would have to convince users to take action, typically via an enticement in email or instant message, or by getting them to open an email attachment.",logged on with administrative user rights,,
CVE-2018-7111,"A remote unauthorized access vulnerability was identified in HPE UIoT versions 1.5, 1.4.0, 1.4.1, 1.4.2, 1.2.4.2. Specifically, there is a malfunction identified in some section of the DSM portal and some DSM APIs. The impact of the malfunction is that the info can be changed by other users.",,,
,"HPE UIoT could allow a remote attacker to gain unauthorized access to the system, caused by a malfunction in the DSM portal and DSM APIs. An attacker could exploit this vulnerability to change information. HPE UIoT 1.5.",,,
,"HPE UIoT v- 1.5,1.4.0, 1.4.1, 1.4.2, 1.2.4.2 has a remote unauthorized data access vulnerability. Specifically, there is a malfunction identified in some section of the DSM portal and some DSM APIs. The impact of the malfunction is that the info can be changed by other users.",,,
CVE-2023-24819,"RIOT-OS, an operating system that supports Internet of Things devices, contains a network stack with the ability to process 6LoWPAN frames. Prior to version 2022.10, an attacker can send a crafted frame to the device resulting in an out of bounds write in the packet buffer. The overflow can be used to corrupt other packets and the allocator metadata. Corrupting a pointer will easily lead to denial of service. While carefully manipulating the allocator metadata gives an attacker the possibility to write data to arbitrary locations and thus execute arbitrary code. Version 2022.10 fixes this issue. As a workaround, disable support for fragmented IP datagrams or apply the patches manually.","Corrupting a pointer, manipulating the allocator metadata","Corrupting a pointer, manipulating the allocator metadata",1
,RIOT-OS. < 2022.10. RIOT-OS contains a network stack with the ability to process 6LoWPAN frames. An attacker can send a crafted frame to the device resulting in an out of bounds write in the packet buffer. The overflow can be used to corrupt other packets and the allocator metadata. Corrupting a pointer will easily lead to denial of service. While carefully manipulating the allocator metadata gives an attacker the possibility to write data to arbitrary locations and thus execute arbitrary code.,"Corrupting a pointer, manipulating the allocator metadata",,
CVE-2018-8479,"A spoofing vulnerability exists for the Azure IoT Device Provisioning for the C SDK library using the HTTP protocol on Windows platform, aka ""Azure IoT SDK Spoofing Vulnerability."" This affects C SDK.",,,
,"A spoofing vulnerability exists for the Azure IoT Device Provisioning for the C SDK library using the HTTP protocol on Windows platform. An attacker who successfully exploited this vulnerability could impersonate a server used during the provisioning process.

To exploit this vulnerability, an attacker would need to perform a man-in-the-middle (MitM) attack on the network that provisioning was taking place.

This security update addresses the vulnerability by correcting how the HTTP transport library validates certificates.

This vulnerability does NOT impact other Azure IoT SDK¡¯s such as Java/Node/C#, does NOT impact the C SDK when running on Linux or embedded OS¡¯s, and only impacts when using the HTTP transport and NOT MQTT or AMQP",perform a man-in-the-middle (MitM) attack on the network that provisioning was taking place,,
CVE-2020-9526,"CS2 Network P2P through 3.x, as used in millions of Internet of Things devices, suffers from an information exposure flaw that exposes user session data to supernodes in the network, as demonstrated by passively eavesdropping on user video/audio streams, capturing credentials, and compromising devices.",,,
,"Hundreds of brands of security cameras, baby monitors, and ¡°smart¡± doorbells have serious vulnerabilities that allow hackers to hijack devices and spy on users. 

Affected devices use ¡°peer-to-peer¡± features (also known as ¡°P2P¡±) that allow users to connect to their devices the moment they come online. Hackers are able to exploit flaws in these features to rapidly find vulnerable cameras, then launch attacks to access them.

Other flaws make it possible for anyone to intercept connections to cameras, then covertly monitor video feeds and steal device passwords ¨C all without the owner ever knowing.",,,
CVE-2023-24821,"RIOT-OS, an operating system that supports Internet of Things devices, contains a network stack with the ability to process 6LoWPAN frames. Prior to version 2022.10, an attacker can send a crafted frame to the device resulting in a large out of bounds write beyond the packet buffer. The write will create a hard fault exception after reaching the last page of RAM. The hard fault is not handled and the system will be stuck until reset, thus the impact is denial of service. Version 2022.10 fixes this issue. As a workaround, disable support for fragmented IP datagrams or apply the patches manually.",,,
,RIOT-OS. < 2022.10. RIOT-OS contains a network stack with the ability to process 6LoWPAN frames. An attacker can send a crafted frame to the device resulting in a large out of bounds write beyond the packet buffer. The write will create a hard fault exception after reaching the last page of RAM. The hard fault is not handled and the system will be stuck until reset. Thus the impact is denial of service.,,,
CVE-2021-21280,"Contiki-NG is an open-source, cross-platform operating system for internet of things devices. It is possible to cause an out-of-bounds write in versions of Contiki-NG prior to 4.6 when transmitting a 6LoWPAN packet with a chain of extension headers. Unfortunately, the written header is not checked to be within the available space, thereby making it possible to write outside the buffer. The problem has been patched in Contiki-NG 4.6. Users can apply the patch for this vulnerability out-of-band as a workaround.",,,
,"Contiki-NG. < 4.6. It is possible to cause an out-of-bounds write in Contiki-NG when transmitting a 6LoWPAN packet with a chain of extension headers. Unfortunately, the written header is not checked to be within the available space, thereby making it possible to write outside the buffer.",,,
CVE-2014-9223,"Multiple buffer overflows in AllegroSoft RomPager, as used in Huawei Home Gateway products and other vendors and products, allow remote attackers to cause a denial of service or possibly execute arbitrary code via unspecified vectors related to authorization.",unspecified vectors related to authorization,"sending a crafted request to the vulnerable server, manipulating cookies, send specially crafted HTTP cookies",4
,"RomPager Authentication Security Bypass ¨CMisfortune Cookie: The vulnerability is due to an insecure design in the RomPager Server. Remote attacker could exploit this vulnerability to access the RomPager web-server under administrator privileges. 

RomPager Authorization Buffer-Overflow Denial of Service: A buffer-overflow vulnerability exist in RomPager Web Server. A remote attacker could exploit this vulnerability by sending a crafted request to the vulnerable server causing a denial of service.

Successful exploitation of this vulnerability may allow attackers to determine the ¡®fortune¡¯ of a request by manipulating cookies. Attackers can send specially crafted HTTP cookies that exploit the vulnerability to corrupt memory and alter the application state.","sending a crafted request to the vulnerable server, manipulating cookies, send specially crafted HTTP cookies",,
CVE-2014-9222,"AllegroSoft RomPager 4.34 and earlier, as used in Huawei Home Gateway products and other vendors and products, allows remote attackers to gain privileges via a crafted cookie that triggers memory corruption, aka the ""Misfortune Cookie"" vulnerability.",a crafted cookie that triggers memory corruption,,
,"Many home and office/home office (SOHO) routers have been found to be using vulnerable versions of the Allegro RomPager embedded web server. Allegro RomPager versions prior to 4.34 contain a vulnerability in cookie processing code that can be leveraged to grant attackers administrative privileges on the device. According to Check Point's advisory, the vulnerability was addressed by Allegro in 2005 but is present in current or recent firmware releases of many devices. A remote, unauthenticated attacker may be able to execute arbitrary code on the device.",,,
CVE-2020-9306,"Tesla SolarCity Solar Monitoring Gateway through 5.46.43 has a ""Use of Hard-coded Credentials"" issue because Digi ConnectPort X2e uses a .pyc file to store the cleartext password for the python user account.",,,
,"Tesla/SolarCity's ConnectPort X2e firmware stored cleartext credentials for the local user python in compiled Python (""PYC"") files. This password could be used by a malicious user to establish an SSH connection to a X2e device as this user.

High - Using the hardcoded credentials, an attacker can connect to any X2e device to extract sensitive information, install a persistence mechanism, escalate privileges, or cause denial of service conditions.",the hardcoded credentials,,
CVE-2020-11790,NETGEAR R7800 devices before 1.0.2.68 are affected by remote code execution by unauthenticated attackers.,,,
,"NETGEAR has released fixes for a unauthenticated remote code execution security vulnerability on the following product models:
R7800, running frimware versions prior to 1.0.2.68",,,
CVE-2019-20215,"D-Link DIR-859 1.05 and 1.06B01 Beta01 devices allow remote attackers to execute arbitrary OS commands via a urn: to the M-SEARCH method in ssdpcgi() in /htdocs/cgibin, because HTTP_ST is mishandled. The value of the urn: service/device is checked with the strstr function, which allows an attacker to concatenate arbitrary commands separated by shell metacharacters.",shell metacharacters,,
,"DIR-859. 1.06b01 Beta01, 1.05. Remote code execution (Unauthenticated, LAN). The remote code execution vulnerability was found in the ssdpcgi() function, where a solution (patch) for the vulnerability had previously been implemented, but the vulnerability still persists because all the environment variables were not filtered correctly. ",,,
CVE-2017-3193,Multiple D-Link devices including the DIR-850L firmware versions 1.14B07 and 2.07.B05 contain a stack-based buffer overflow vulnerability in the web administration interface HNAP service.,,,
,"D-Link DIR-850L, firmware versions 1.14B07, 2.07.B05, and possibly others, contains a stack-based buffer overflow vulnerability in the web administration interface HNAP service. Other models may also be affected. A remote, unauthenticated attacker can make a specially crafted POST request to gain arbitrary code execution as root.",make a specially crafted POST request,,
CVE-2020-8861,This vulnerability allows network-adjacent attackers to bypass authentication on affected installations of D-Link DAP-1330 1.10B01 BETA Wi-Fi range extenders. Authentication is not required to exploit this vulnerability. The specific flaw exists within the handling of HNAP login requests. The issue results from the lack of proper handling of cookies. An attacker can leverage this vulnerability to execute arbitrary code on the router. Was ZDI-CAN-9554.,,,
,Trend Micro's Zero Day Initiative (ZDI) research team submitted a HNAP Authentication Bypass Vulnerability that is  logic flaw in the implementation of the HNAP login algorithm allowing an attacker to bypass authentication and reset the admin password.,,,
,"D-Link. DAP-1330. This vulnerability allows network-adjacent attackers to bypass authentication on affected installations of D-Link DAP-1330 Wi-Fi range extenders. Authentication is not required to exploit this vulnerability.

The specific flaw exists within the handling of HNAP login requests. The issue results from the lack of proper handling of cookies. An attacker can leverage this vulnerability to execute arbitrary code on the router.",,,
CVE-2022-36233,"Tenda AC9 V15.03.2.13 is vulnerable to Buffer Overflow via httpd, form_fast_setting_wifi_set. httpd.",,,
,Tenda AC9 firmware V15.03.2.13 httpd server has stack buffer overflow in form_fast_setting_wifi_set,,,
CVE-2022-24355,This vulnerability allows network-adjacent attackers to execute arbitrary code on affected installations of TP-Link TL-WR940N 3.20.1 Build 200316 Rel.34392n (5553) routers. Authentication is not required to exploit this vulnerability. The specific flaw exists within the parsing of file name extensions. The issue results from the lack of proper validation of the length of user-supplied data prior to copying it to a fixed-length stack-based buffer. An attacker can leverage this vulnerability to execute code in the context of root. Was ZDI-CAN-13910.,,,
,"TP-Link. TL-WR940N. This vulnerability allows network-adjacent attackers to execute arbitrary code on affected installations of TP-Link TL-WR940N routers. Authentication is not required to exploit this vulnerability.

The specific flaw exists within the parsing of file name extensions. The issue results from the lack of proper validation of the length of user-supplied data prior to copying it to a fixed-length stack-based buffer. An attacker can leverage this vulnerability to execute code in the context of root.",,,
CVE-2022-26258,D-Link DIR-820L 1.05B03 was discovered to contain remote command execution (RCE) vulnerability via HTTP POST to get set ccp.,,,
,"D-Link. DIR-820L. 1.05 B03. In the handler of route /lan.asp, the value of parameter Device Name can inject command. Parameters are filtered on both the front-end and the back-end.

Grab traffic packets to bypass front-end filtering.

The backend filter function is: hasInjectionString (in file lib/libleopard.so).The symbol \n is not filtered.",,,
CVE-2015-2051,The D-Link DIR-645 Wired/Wireless Router Rev. Ax with firmware 1.04b12 and earlier allows remote attackers to execute arbitrary commands via a GetDeviceSettings action to the HNAP interface.,a GetDeviceSettings action to the HNAP interface,,
,"Different D-Link Routers are vulnerable to OS command injection in the HNAP SOAP interface. Since it is a blind OS command injection vulnerability, there is no output for the executed command. This module has been tested on a DIR-645 device. The following devices are also reported as affected: DAP-1522 revB, DAP-1650 revB, DIR-880L, DIR-865L, DIR-860L revA, DIR-860L revB DIR-815 revB, DIR-300 revB, DIR-600 revB, DIR-645, TEW-751DR, TEW-733GR",,,
CVE-2016-10372,"The Eir D1000 modem does not properly restrict the TR-064 protocol, which allows remote attackers to execute arbitrary commands via TCP port 7547, as demonstrated by opening WAN access to TCP port 80, retrieving the login password (which defaults to the Wi-Fi password), and using the NewNTPServer feature.",TCP port 7547,,
,"The Eir D1000 Modem has bugs that allow an attacker to gain full control of the modem from the Internet. The modem could then be used to hack into internal computers on the network, as a proxy host to hack other computers or even as a bot in a botnet.",,,
CVE-2013-7471,"An issue was discovered in soap.cgi?service=WANIPConn1 on D-Link DIR-845 before v1.02b03, DIR-600 before v2.17b01, DIR-645 before v1.04b11, DIR-300 rev. B, and DIR-865 devices. There is Command Injection via shell metacharacters in the NewInternalClient, NewExternalPort, or NewInternalPort element of a SOAP POST request.","shell metacharacters in the NewInternalClient, NewExternalPort, or NewInternalPort element of a SOAP POST request",,
,"Different D-Link Routers are vulnerable to OS command injection in the UPnP SOAP interface. Since it is a blind OS command injection vulnerability, there is no output for the executed command when using the CMD target. Additionally, two targets are included, to start a telnetd service and establish a session over it, or deploy a native mipsel payload. This module has been tested successfully on DIR-300, DIR-600, DIR-645, DIR-845 and DIR-865. According to the vulnerability discoverer, more D-Link devices may affected.",,,
CVE-2020-10173,"Comtrend VR-3033 DE11-416SSG-C01_R02.A2pvI042j1.d26m devices have Multiple Authenticated Command Injection vulnerabilities via the ping and traceroute diagnostic pages, as demonstrated by shell metacharacters in the pingIpAddress parameter to ping.cgi.",,,
,"# Title: Comtrend VR-3033 - Authenticated Command Injection
# Date: 2020-02-26
# Author: Author : Raki Ben Hamouda
# Vendor: https://us.comtrend.com
# Product link: https://us.comtrend.com/products/vr-3030/
# CVE: CVE-2020-10173

The Comtrend VR-3033 is prone to Multiple Authenticated Command Injection
vulnerability via ping and traceroute diagnostic page.
Remote attackers are able to get full control and compromise the network
managed by the router.

Note : This bug may exist in other Comtrend routers .
===============================================
Product Page :
https://us.comtrend.com/products/vr-3030/

Firmware version :
DE11-416SSG-C01_R02.A2pvI042j1.d26m

Bootloader (CFE) Version :
 1.0.38-116.228-1

To reproduce the vulnerability attacker has to access the interface at
least with minimum privilege.","access the interface at
least with minimum privilege",,
CVE-2020-12109,"Certain TP-Link devices allow Command Injection. This affects NC200 2.1.9 build 200225, NC210 1.0.9 build 200304, NC220 1.3.0 build 200304, NC230 1.3.0 build 200304, NC250 1.3.0 build 200304, NC260 1.5.2 build 200304, and NC450 1.5.3 build 200304.",,,
,"Vulnerability title: TP-LINK Cloud Cameras NCXXX Bonjour Command Injection
Author: Pietro Oliva
CVE: CVE-2020-12109
Vendor: TP-LINK
Product: NC200, NC210, NC220, NC230, NC250, NC260, NC450
Affected version: NC200 <= 2.1.9 build 200225, NC210 <= 1.0.9 build 200304,
                  NC220 <= 1.3.0 build 200304, NC230 <= 1.3.0 build 200304,
                  NC250 <= 1.3.0 build 200304, NC260 <= 1.5.2 build 200304,
                  NC450 <= 1.5.3 build 200304.

Fixed version:    NC200 <= 2.1.10 build 200401, NC210 <= 1.0.10 build 200401,
                  NC220 <= 1.3.1 build 200401, NC230 <= 1.3.1 build 200401,
                  NC250 <= 1.3.1 build 200401, NC260 <= 1.5.3 build_200401,
                  NC450 <= 1.5.4 build 200401

Description:
The issue is located in the swSystemSetProductAliasCheck method of the
ipcamera binary (Called when setting a new alias for the device via
/setsysname.fcgi), where despite a check on the name length, no other checks
are in place in order to prevent shell metacharacters from being introduced.
The system name would then be used in swBonjourStartHTTP as part of a shell
command where arbitrary commands could be injected and executed as root.",,,
,"TP-LINK Cloud Cameras including products NC200, NC210, NC220, NC230, NC250, NC260, and NC450 suffer from a command injection vulnerability. The issue is located in the swSystemSetProductAliasCheck method of the ipcamera binary (Called when setting a new alias for the device via /setsysname.fcgi), where despite a check on the name length, no other checks are in place in order to prevent shell metacharacters from being introduced. The system name would then be used in swBonjourStartHTTP as part of a shell command where arbitrary commands could be injected and executed as root.",,,
,"TP-Link cloud cameras NCXXX series (NC200, NC210, NC220, NC230, NC250, NC260, NC450) are vulnerable to an authenticated command injection vulnerability. In all devices except NC210, despite a check on the name length in swSystemSetProductAliasCheck, no other checks are in place in order to prevent shell metacharacters from being introduced. The system name would then be used in swBonjourStartHTTP as part of a shell command where arbitrary commands could be injected and executed as root. NC210 devices cannot be exploited directly via /setsysname.cgi due to proper input validation. NC210 devices are still vulnerable since swBonjourStartHTTP did not perform any validation when reading the alias name from the configuration file. The configuration file can be written, and code execution can be achieved by combining this issue with CVE-2020-12110.",,,
CVE-2020-13117,Wavlink WN575A4 and WN579X3 devices through 2020-05-15 allow unauthenticated remote users to inject commands via the key parameter in a login request.,,,
,"Several Wavlink products are affected by a vulnerability that may allow remote unauthenticated users to execute arbitrary commands as root on Wavlink devices. The user input is not properly sanitized which allows command injection via the ""key"" parameter in a login request. It has been tested on Wavlink WN575A4 and WN579X3 devices, but other products may be affected.",,,
CVE-2020-13782,D-Link DIR-865L Ax 1.20B01 Beta devices allow Command Injection.,,,
,"CVE-2020-13782: Improper Neutralization of Special Elements Used in a Command (Command Injection)
The web interface for this router is controlled by the backend engine called cgibin.exe. Most requests for web pages are sent to this controller. If a request for scandir.sgi is made, a malicious actor can inject arbitrary code to be executed on the router with administrative privileges.",a request for scandir.sgi is made,,
CVE-2020-15922,There is an OS Command Injection in Mida eFramework 2.9.0 that allows an attacker to achieve Remote Code Execution (RCE) with administrative (root) privileges. Authentication is required.,,,
,Mida eFramework version 2.8.9 suffers from a remote code execution vulnerability.,,,
,"(Unauthenticated <= 2.8.9, Authenticated 2.9.0) There is an OS Command Injection in eFramework <= 2.8.9 that allows an attacker to trigger a Remote Code Execution (RCE), with administrative (root) privileges, through OS Command Injection. No authentication is required. The injection point resides on an undisclosed PHP page. Impact: OS Code Execution",,,
CVE-2020-16205,"Using a specially crafted URL command, a remote authenticated user can execute commands as root on the G-Cam and G-Code (Firmware Versions 1.12.0.25 and prior as well as the limited Versions 1.12.13.2 and 1.12.14.5).",a specially crafted URL command,a specially crafted URL command,1
,"Vendor: Geutebr¨¹ck
Equipment: G-Cam and G-Code
Vulnerability: OS Command Injection
Successful exploitation of this vulnerability could allow remote code execution as root.
Geutebruck reports the vulnerability affects firmware Versions 1.12.0.25 and prior as well as the limited Versions 1.12.13.2 and 1.12.14.5 of the following Encoder and E2 Series Camera models:
G-Code: 
EEC-2xxx
G-Cam: 
EBC-21xx
EFD-22xx
ETHC-22xx
EWPC-22xx
Using a specially crafted URL command, a remote authenticated user can execute commands as root.",a specially crafted URL command,the 'type' GET parameter is set to 'ntp',4
,"This Metasploit module exploits an authenticated arbitrary command execution vulnerability within the 'server' GET parameter of the /uapi-cgi/testaction.cgi page of Geutebruck G-Cam EEC-2xxx and G-Code EBC-21xx, EFD-22xx, ETHC-22xx, and EWPC-22xx devices running firmware versions <= 1.12.0.25 as well as firmware versions 1.12.13.2 and 1.12.14.5 when the 'type' GET parameter is set to 'ntp'. Successful exploitation results in remote code execution as the root user.",the 'type' GET parameter is set to 'ntp',a specially crafted URL command,4
CVE-2020-17456,SEOWON INTECH SLC-130 And SLR-120S devices allow Remote Code Execution via the ipAddr parameter to the system_log.cgi page.,,,
