CVE ID,src txt,attack vector1,attack vector2,value
,"# Exploit Title: Seowon SLR-120 Router - Remote Code Execution (Unauthenticated)
# Date: 2022-03-11
# Exploit Author: Aryan Chehreghani
# Vendor Homepage: http://www.seowonintech.co.kr
# Software Link: http://www.seowonintech.co.kr/en/product/detail.asp?num=126&big_kind=B05&middle_kind=B05_30
# Version: All version
# Tested on: Windows 10 Enterprise x64 , Linux
# CVE : CVE-2020-17456

# [ About - Seowon SLR-120 router ]:

#The SLR-120 series are provide consistent access to LTE networks and transforms it to your own hotspot while being mobile,
#The convenience of sharing wireless internet access invigorates your lifestyle, families,
#friends and workmates. Carry it around to boost your active communication anywhere.

# [ Description ]:

#Execute commands without authentication as admin user ,
#To use it in all versions, we only enter the router ip & Port(if available) in the script and Execute commands with root user.

# [ Vulnerable products ]:

#SLR-120S42G
#SLR-120D42G
#SLR-120T42G
",enter the router ip & Port(if available) in the script and Execute commands with root user,,
,"Seowon SLR-120 RCE Exploit | Seowon SLR-120 - Remote Code Execution ( Unauthenticated ) | CVE-2020-17456

Vulnerable products : SLR-120S42G , SLR-120D42G , SLR-120T42G ( All Version )",,,
CVE-2020-24217,"An issue was discovered in the box application on HiSilicon based IPTV/H.264/H.265 video encoders. The file-upload endpoint does not enforce authentication. Attackers can send an unauthenticated HTTP request to upload a custom firmware component, possibly in conjunction with command injection, to achieve arbitrary code execution.","send an unauthenticated HTTP request, conjunction with command injection",an unauthenticated upload of malicious firmware,4
,"Multiple vulnerabilities exist in various Video Over IP (Internet Protocol) encoder devices, also known as IPTV/H.264/H.265 video encoders. These vulnerabilities allow an unauthenticated remote attacker to execute arbitrary code and perform other unauthorized actions on a vulnerable system.

The impact of these vulnerabilities are summarized in the following list:

Full administrative access via backdoor password (CVE-2020-24215)
Administrative root access via backdoor password (CVE-2020-24218)
Arbitrary file read via path traversal (CVE-2020-24219)
Unauthenticated file upload (CVE-2020-24217)
Arbitrary code execution by uploading malicious firmware (CVE-2020-24217)
Arbitrary code execution via command injection (CVE-2020-24217)
Denial of service via buffer overflow (CVE-2020-24214)
Unauthorized video stream access via RTSP (CVE-2020-24216)",,,
,"This article discloses critical vulnerabilities in IPTV/H.264/H.265 video encoders based on HiSilicon hi3520d hardware. The vulnerabilities exist in vendor application software running on these devices. All vulnerabilities are exploitable remotely and can lead to sensitive information exposure, denial of service, and remote code execution resulting in full takeover of the device. With multiple vendors affected, and no complete fixes at the time of the publication, these encoders should only be used on fully trusted networks behind firewalls. I hope that my detailed write-up serves as a guide for more security research in the IoT world.",,,
,HiSilicon Video Encoder suffers from a remote code execution vulnerability via an unauthenticated upload of malicious firmware. Versions affected are vendor specific.,an unauthenticated upload of malicious firmware,,
,HiSilicon Video Encoder suffers from a remote command injection vulnerability. Versions affected are vendor specific.,,,
CVE-2020-25506,"D-Link DNS-320 FW v2.06B01 Revision Ax is affected by command injection in the system_mgr.cgi component, which can lead to remote arbitrary code execution.",,,
,D-Link was made aware of a Command Injection Vulnerability report by Swing of Chaitin Security Research Lab affecting the D-Link Network Attached Storage (NAS): DNS-320 Revison Ax. ,,,
CVE-2020-26919,NETGEAR JGS516PE devices before 2.6.0.43 are affected by lack of access control at the function level.,,,
,"NETGEAR has released fixes for a missing function level access control security vulnerability on the following product models:

JGS516PE, running firmware versions prior to 2.6.0.43",,,
CVE-2020-35665,An unauthenticated command-execution vulnerability exists in TerraMaster TOS through 4.2.06 via shell metacharacters in the Event parameter in include/makecvs.php during CSV creation.,,,
,"Name' => ""TerraMaster TOS 4.2.06 - Unauthenticated Remote Code Execution"",
      'Description' => %q(
        This module exploits a unauthenticated command execution vulnerability in TerraMaster TOS.
        The ""Event"" parameter in ""include/makecvs.php"" contains a vulnerability. 
        ""filename"" is executing command on system during "".csv"" creation. 
        In order to do this, it is not necessary to have a session in the application.
        Therefore an unathenticated user can execute the command on the system.
      )",,,
,"This module exploits a unauthenticated command execution vulnerability in TerraMaster TOS <= 4.2.06. The ""Event"" parameter in ""include/makecvs.php"" contains a vulnerability. ""filename"" is executing command on system during "".csv"" creation. In order to do this, it is not necessary to have a session in the application. Therefore an unathenticated user can execute the command on the system.",,,
,"This Metasploit module exploits an unauthenticated remote code execution vulnerability in TerraMaster TOS versions 4.2.06 and below via shell metacharacters in the Event parameter at vulnerable endpoint include/makecvs.php during CSV creation. Any unauthenticated user can therefore execute commands on the system under the same privileges as the web application, which typically runs under root at the TerraMaster Operating System.",,,
CVE-2020-28188,Remote Command Execution (RCE) vulnerability in TerraMaster TOS <= 4.2.06 allow remote unauthenticated attackers to inject OS commands via /include/makecvs.php in Event parameter.,,,
,"This Metasploit module exploits an unauthenticated remote code execution vulnerability in TerraMaster TOS versions 4.2.06 and below via shell metacharacters in the Event parameter at vulnerable endpoint include/makecvs.php during CSV creation. Any unauthenticated user can therefore execute commands on the system under the same privileges as the web application, which typically runs under root at the TerraMaster Operating System.",,,
,"The vulnerability is caused by a lack of input validation in the ¡°event¡± parameter in the ¡°makecvs¡± PHP page (/include/makecvs.php). This allows a remote unauthenticated attacker to inject OS commands, and gain control of the servers using TerraMaster TOS (versions prior to  4.2.06).",,,
CVE-2020-5902,"In BIG-IP versions 15.0.0-15.1.0.3, 14.1.0-14.1.2.5, 13.1.0-13.1.3.3, 12.1.0-12.1.5.1, and 11.6.1-11.6.5.1, the Traffic Management User Interface (TMUI), also referred to as the Configuration utility, has a Remote Code Execution (RCE) vulnerability in undisclosed pages.",,,
,"F5 BIG-IP provides a Traffic Management User Interface (TMUI), also referred to as the Configuration utility, that has multiple vulnerabilities including a remotely exploitable command injection vulnerability that can be used to execute arbitrary commands and subsequently take control of a vulnerable system. An unauthenticated attacker with network access to the TMUI may be able to execute arbitrary system commands, create or delete files, disable services, and subsequently execute arbitrary code with high privileges such as root. An authenticated user is also be able to perform unexpected activities such as changing configuration files on a vulnerable device.",,,
,"BIG-IP versions 15.0.0 through 15.1.0.3, 14.1.0 through 14.1.2.5, 13.1.0 through 13.1.3.3, 12.1.0 through 12.1.5.1, and 11.6.1 through 11.6.5.1 suffer from Traffic Management User Interface (TMUI) arbitrary file read and command execution vulnerabilities.",,,
,"This exploit demonstrates the remote code execution vulnerability in the Traffic Management User Interface (TMUI) in BIG-IP versions 15.0.0 through 15.1.0.3, 14.1.0 through 14.1.2.5, 13.1.0 through 13.1.3.3, 12.1.0 through 12.1.5.1, and 11.6.1 through 11.6.5.1.",,,
,This Metasploit module exploits a directory traversal in F5's BIG-IP Traffic Management User Interface (TMUI) to upload a shell script and execute it as the root user.,,,
,"BIG-IP versions 15.0.0 through 15.1.0.3, 14.1.0 through 14.1.2.5, 13.1.0 through 13.1.3.3, 12.1.0 through 12.1.5.1, and 11.6.1 through 11.6.5.1 suffer from Traffic Management User Interface (TMUI) arbitrary file read and command execution vulnerabilities. Checker CVE-2020-5902 is a scanning tool to look for vulnerable instances.",,,
,F5 Big-IP versions 13.1.3 Build 0.0.6 and below suffer from a local file inclusion vulnerability.,,,
,"This Metasploit module exploits a directory traversal in F5's BIG-IP Traffic Management User Interface (TMUI) to upload a shell script and execute it as the Unix root user. Unix shell access is obtained by escaping the restricted Traffic Management Shell (TMSH). The escape may not be reliable, and you may have to run the exploit multiple times. Versions 11.6.1-11.6.5, 12.1.0-12.1.5, 13.1.0-13.1.3, 14.1.0-14.1.2, 15.0.0, and 15.1.0 are known to be vulnerable. Fixes were introduced in 11.6.5.2, 12.1.5.2, 13.1.3.4, 14.1.2.6, and 15.1.0.4. Tested against the VMware OVA release of 14.1.2.",,,
CVE-2021-22986,"On BIG-IP versions 16.0.x before 16.0.1.1, 15.1.x before 15.1.2.1, 14.1.x before 14.1.4, 13.1.x before 13.1.3.6, and 12.1.x before 12.1.5.3 amd BIG-IQ 7.1.0.x before 7.1.0.3 and 7.0.0.x before 7.0.0.2, the iControl REST interface has an unauthenticated remote command execution vulnerability. Note: Software versions which have reached End of Software Development (EoSD) are not evaluated.",,,
,This Metasploit module exploits a pre-authentication server-side request forgery vulnerability in the F5 iControl REST API's /mgmt/shared/authn/login endpoint to generate an X-F5-Auth-Token that can be used to execute root commands on an affected BIG-IP or BIG-IQ device.,generate an X-F5-Auth-Token,"the BIG-IP management interface and self IP addresses, the control plane",4
,F5 BIG-IP version 16.0.x suffers from an iControl REST remote code execution vulnerability.,,,
,"The iControl REST interface has an unauthenticated remote command execution vulnerability. This vulnerability allows for unauthenticated attackers with network access to the iControl REST interface, through the BIG-IP management interface and self IP addresses, to execute arbitrary system commands, create or delete files, and disable services. This vulnerability can only be exploited through the control plane and cannot be exploited through the data plane. Exploitation can lead to complete system compromise. The BIG-IP system in Appliance mode is also vulnerable.","the BIG-IP management interface and self IP addresses, the control plane",,
CVE-2021-22991,"On BIG-IP versions 16.0.x before 16.0.1.1, 15.1.x before 15.1.2.1, 14.1.x before 14.1.4, 13.1.x before 13.1.3.6, and 12.1.x before 12.1.5.3, undisclosed requests to a virtual server may be incorrectly handled by the Traffic Management Microkernel (TMM) URI normalization, which may trigger a buffer overflow, resulting in a DoS attack. In certain situations, it may theoretically allow bypass of URL based access control or remote code execution (RCE). Note: Software versions which have reached End of Software Development (EoSD) are not evaluated.",,,
,"Undisclosed requests to a virtual server may be incorrectly handled by Traffic Management Microkernel (TMM) URI normalization, which may trigger a buffer overflow, resulting in a DoS attack. In certain situations, it theoretically may allow bypass of URL based access control or remote code execution (RCE). An issue with the Traffic Management Microkernel (TMM) process has been discovered in versions 16.0.1.1 and 14.1.4. An issue with the bigd process has been discovered in version 12.1.5.3.",,,
CVE-2020-7209,LinuxKI v6.0-1 and earlier is vulnerable to an remote code execution which is resolved in release 6.0-2.,,,
,HP LinuxKI version 6.01 suffers from a command injection vulnerability.,,,
,"This Metasploit module exploits a vulnerability in LinuxKI Toolset versions 6.01 and below which allows remote code execution. The kivis.php pid parameter received from the user is sent to the shell_exec function, resulting in the security vulnerability.",,,
CVE-2020-9054,"Multiple ZyXEL network-attached storage (NAS) devices running firmware version 5.21 contain a pre-authentication command injection vulnerability, which may allow a remote, unauthenticated attacker to execute arbitrary code on a vulnerable device. ZyXEL NAS devices achieve authentication by using the weblogin.cgi CGI executable. This program fails to properly sanitize the username parameter that is passed to it. If the username parameter contains certain characters, it can allow command injection with the privileges of the web server that runs on the ZyXEL device. Although the web server does not run as the root user, ZyXEL devices include a setuid utility that can be leveraged to run any command with root privileges. As such, it should be assumed that exploitation of this vulnerability can lead to remote code execution with root privileges. By sending a specially-crafted HTTP POST or GET request to a vulnerable ZyXEL device, a remote, unauthenticated attacker may be able to execute arbitrary code on the device. This may happen by directly connecting to a device if it is directly exposed to an attacker. However, there are ways to trigger such crafted requests even if an attacker does not have direct connectivity to a vulnerable devices. For example, simply visiting a website can result in the compromise of any ZyXEL device that is reachable from the client system. Affected products include: NAS326 before firmware V5.21(AAZF.7)C0 NAS520 before firmware V5.21(AASZ.3)C0 NAS540 before firmware V5.21(AATB.4)C0 NAS542 before firmware V5.21(ABAG.4)C0 ZyXEL has made firmware updates available for NAS326, NAS520, NAS540, and NAS542 devices. Affected models that are end-of-support: NSA210, NSA220, NSA220+, NSA221, NSA310, NSA310S, NSA320, NSA320S, NSA325 and NSA325v2",sending a specially-crafted HTTP POST or GET request to a vulnerable ZyXEL device,sending a specially-crafted HTTP POST or GET request to a vulnerable ZyXEL device,1
,"Multiple ZyXEL devices contain a pre-authentication command injection vulnerability, which may allow a remote, unauthenticated attacker to execute arbitrary code on a vulnerable device. By sending a specially-crafted HTTP POST or GET request to a vulnerable ZyXEL device, a remote, unauthenticated attacker may be able to execute arbitrary code on the device. This may happen by directly connecting to a device if it is directly exposed to an attacker. However, there are ways to trigger such crafted requests even if an attacker does not have direct connectivity to a vulnerable devices. For example, simply visiting a website can result in the compromise of any ZyXEL device that is reachable from the client system.",sending a specially-crafted HTTP POST or GET request to a vulnerable ZyXEL device,,
CVE-2021-28150,Hongdian H8922 3.0.5 devices allow the unprivileged guest user to read cli.conf (with the administrator password and other sensitive data) via /backup2.cgi.,/backup2.cgi,,
,"Several vulnerabilities in the H8922 device allow remote attackers to cause the device to execute arbitrary commands with root privileges due to the fact that user provided data is not properly filtered as well as a backdoor account allows access via port 5188/tcp. Affected Versions : 
Hongdian H8922 version 3.0.5",,,
CVE-2021-27561,"Yealink Device Management (DM) 3.6.0.20 allows command injection as root via the /sm/api/v1/firewall/zone/services URI, without authentication.","the /sm/api/v1/firewall/zone/services URI, without authentication",,
,Several vulnerabilities in the Yealink DM server allow remote unauthenticated attackers to cause the server to execute arbitrary commands due to the fact that user provided data is not properly filtered. Affected Versions : Yealink DM version 3.6.0.20 and prior,,,
CVE-2021-28797,"A stack-based buffer overflow vulnerability has been reported to affect QNAP NAS devices running Surveillance Station. If exploited, this vulnerability allows attackers to execute arbitrary code. QNAP have already fixed this vulnerability in the following versions: Surveillance Station 5.1.5.4.3 (and later) for ARM CPU NAS (64bit OS) and x86 CPU NAS (64bit OS) Surveillance Station 5.1.5.3.3 (and later) for ARM CPU NAS (32bit OS) and x86 CPU NAS (32bit OS)",,,
,"A stack-based buffer overflow vulnerability has been reported to affect QNAP NAS devices running Surveillance Station. If exploited, this vulnerability allows attackers to execute arbitrary code.",,,
CVE-2021-28810,"If exploited, this vulnerability allows an attacker to access resources which are not otherwise accessible without proper authentication. Roon Labs has already fixed this vulnerability in the following versions: Roon Server 2021-05-18 and later",,,
,"The QNAP security team has detected an attack campaign in the wild related to a vulnerability in Roon Server. QNAP NAS running the following versions of Roon Server may be susceptible to attack:


Roon Server 2021-02-01 and earlier

Roon Labs has already fixed this vulnerability in the following versions:


Roon Server 2021-05-18 and later",,,
CVE-2021-29003,"Genexis PLATINUM 4410 2.1 P4410-V2-1.28 devices allow remote attackers to execute arbitrary code via shell metacharacters to sys_config_valid.xgi, as demonstrated by the sys_config_valid.xgi?exeshell=%60telnetd%20%26%60 URI.",shell metacharacters to sys_config_valid.xgi,,
,Genexis PLATINUM 4410 version 2.1 P4410-V2-1.28 suffers from a remote command execution vulnerability.,,,
CVE-2021-1497,"Multiple vulnerabilities in the web-based management interface of Cisco HyperFlex HX could allow an unauthenticated, remote attacker to perform command injection attacks against an affected device. For more information about these vulnerabilities, see the Details section of this advisory.",,,
,This Metasploit module exploits an unauthenticated command injection in Cisco HyperFlex HX Data Platform's /storfs-asup endpoint to execute shell commands as the Tomcat user.,,,
,"Multiple vulnerabilities in the web-based management interface of Cisco HyperFlex HX could allow an unauthenticated, remote attacker to perform command injection attacks against an affected device.",,,
CVE-2017-7876,"This command injection vulnerability in QTS allows attackers to run arbitrary commands in the compromised application. QNAP have already fixed the issue in QTS 4.2.6 build 20170517, QTS 4.3.3.0174 build 20170503 and later versions.",,,
,"This command injection vulnerability in QTS allows attackers to run arbitrary commands in the compromised application. We have already fixed the issue in QTS 4.2.6 build 20170517, QTS 4.3.3.0174 build 20170503 and later versions.",,,
CVE-2021-33514,"Certain NETGEAR devices are affected by command injection by an unauthenticated attacker via the vulnerable /sqfs/lib/libsal.so.0.0 library used by a CGI application, as demonstrated by setup.cgi?token=';$HTTP_USER_AGENT;' with an OS command in the User-Agent field. This affects GC108P before 1.0.7.3, GC108PP before 1.0.7.3, GS108Tv3 before 7.0.6.3, GS110TPPv1 before 7.0.6.3, GS110TPv3 before 7.0.6.3, GS110TUPv1 before 1.0.4.3, GS710TUPv1 before 1.0.4.3, GS716TP before 1.0.2.3, GS716TPP before 1.0.2.3, GS724TPPv1 before 2.0.4.3, GS724TPv2 before 2.0.4.3, GS728TPPv2 before 6.0.6.3, GS728TPv2 before 6.0.6.3, GS752TPPv1 before 6.0.6.3, GS752TPv2 before 6.0.6.3, MS510TXM before 1.0.2.3, and MS510TXUP before 1.0.2.3.",the vulnerable /sqfs/lib/libsal.so.0.0 library used by a CGI application,,
,"NETGEAR has released fixes for a pre-authentication command injection security vulnerability on the following product models:

GC108P running firmware versions prior to 1.0.7.3
GC108PP running firmware versions prior to 1.0.7.3
GS108Tv3 running firmware versions prior to 7.0.6.3
GS110TPPv1 running firmware versions prior to  7.0.6.3
GS110TPv3 running firmware versions prior to 7.0.6.3
GS110TUPv1 running firmware versions prior to 1.0.4.3
GS710TUPv1 running firmware versions prior to 1.0.4.3
GS716TP running firmware versions prior to 1.0.2.3
GS716TPP running firmware versions prior to 1.0.2.3
GS724TPPv1 running firmware versions prior to 2.0.4.3
GS724TPv2 running firmware versions prior to 2.0.4.3
GS728TPPv2 running firmware versions prior to 6.0.6.3
GS728TPv2 running firmware versions prior to 6.0.6.3
GS752TPPv1 running firmware versions prior to 6.0.6.3
GS752TPv2 running firmware versions prior to 6.0.6.3
MS510TXM running firmware versions prior to 1.0.2.3
MS510TXUP running firmware versions prior to 1.0.2.3",,,
,"Affected Model: NETGEAR GS110TPV3 Smart Managed Pro Switch
Firmware Version: V7.0.5.2 (from 2021-01-11)

NETGEAR GS110TPV3 Smart Managed Pro Switch is vulnerable to a pre-auth shell
injection due to incorrect input handling in setup.cgi query parameters.
This allows an attacker in the same LAN to run arbitrary commands as root on
the switch.

Attached PoC will execute the given commands as root and send the result to a
provided open TCP port (technically as an HTTP packet).

This report also points out two buffer overflows, though they are believed to be
not directly exploitable.

IMPORTANT: This vulnerability is reported under the 90-day policy, i.e. this
report will be shared publicly with the defensive community on 17th May 2021.
See https://www.google.com/about/appsecurity/ for details.",,,
CVE-2021-36380,Sunhillo SureLine before 8.7.0.1.1 allows Unauthenticated OS Command Injection via shell metacharacters in ipAddr or dnsAddr /cgi/networkDiag.cgi.,,,
,"Versions affected: SureLine <= 8.7.0 
Systems Affected: Any using SureLine 

Summary
Sunhillo is an industry leader in surveillance data distribution. The Sunhillo SureLine application contained an unauthenticated operating system (OS) command injection vulnerability that allowed an attacker to execute arbitrary commands with root privileges. This would have allowed for a threat actor to establish an interactive channel, effectively taking control of the target system.

Impact
Complete system compromise. With the threat actor in full control of the device they could cause a denial of service or utilise the device for persistence on the network.",establish an interactive channel,,
CVE-2020-8862,This vulnerability allows network-adjacent attackers to bypass authentication on affected installations of D-Link DAP-2610 Firmware v2.01RC067 routers. Authentication is not required to exploit this vulnerability. The specific flaw exists within the handling of passwords. The issue results from the lack of proper password checking. An attacker can leverage this vulnerability to execute arbitrary code in the context of root. Was ZDI-CAN-10082.,,,
,Trend Micro's Zero Day Initiative (ZDI) research team submitted a Comparison Authentication Bypass Vulnerability that may result in a Remote Code Execution (RCE) Security Vulnerability report that affects the DAP-2610 Hardware Revision Ax. This vulnerability allowed an malicious user to affect the device that could cause the device to malfunction or disclose information.,,,
,"D-Link.  DAP-2610. This vulnerability allows network-adjacent attackers to bypass authentication on affected installations of D-Link DAP-2610 routers. Authentication is not required to exploit this vulnerability.

The specific flaw exists within the handling of passwords. The issue results from the lack of proper password checking. An attacker can leverage this vulnerability to execute arbitrary code in the context of root.",,,
CVE-2020-8864,"This vulnerability allows network-adjacent attackers to bypass authentication on affected installations of D-Link DIR-867, DIR-878, and DIR-882 routers with firmware 1.10B04. Authentication is not required to exploit this vulnerability. The specific flaw exists within the handling of HNAP login requests. The issue results from the lack of proper handling of empty passwords. An attacker can leverage this vulnerability to execute arbitrary code on the router. Was ZDI-CAN-9471.",,,
,"D-Link. Multiple Routers.  
This vulnerability allows network-adjacent attackers to bypass authentication on affected installations of D-Link DIR-867, DIR-878, and DIR-882 routers. Authentication is not required to exploit this vulnerability.

The specific flaw exists within the handling of HNAP login requests. The issue results from the lack of proper handling of empty passwords. An attacker can leverage this vulnerability to execute arbitrary code on the router.",,,
,Trend Micro's Zero Day Initiative (ZDI) research team submitted two security-related issues (1) CVE-2020-8863 (ZDI ID: ZDI-CAN-9470) an HNAP PrivateLogin Incorrect Implementation of Authentication Algorithm Authentication Bypass vulnerability and (2) CVE-2020-8864 (ZDI ID: ZDI-CAN-9471) an HNAP strncmp Incorrect Comparison Authentication Bypass vulnerability. These vulnerabilities are  logic flaws in the implementation of the HNAP allowing an LAN-Side attacker to bypass authentication and reset the admin password,,,
