CVE ID,src txt1,vulnerability type,src_txt2,vulnerability type,value(1:consistent;2:henterngous;3:containted;4:Divergent;5:Repugnant)
CVE-2023-33973,"RIOT-OS, an operating system for Internet of Things (IoT) devices, contains a network stack with the ability to process 6LoWPAN frames. In versions 2023.01 and prior, an attacker can send a crafted frame which is forwarded by the device. During encoding of the packet a NULL pointer dereference occurs. This crashes the device leading to denial of service. A patch is available at pull request 19678. There are no known workarounds.",NULL pointer dereference,RIOT-OS. <= 2023.01. RIOT-OS contains a network stack with the ability to process 6LoWPAN frames. An attacker can send a crafted frame which is forwarded by the device. During encoding of the packet a NULL pointer dereference occurs. This crashes the device leading to denial of service.,NULL pointer dereference,1
CVE-2018-8531,"A remote code execution vulnerability exists in the way that Azure IoT Hub Device Client SDK using MQTT protocol accesses objects in memory, aka ""Azure IoT Device Client SDK Memory Corruption Vulnerability."" This affects Hub Device Client SDK, Azure IoT Edge.",remote code execution vulnerability,"A remote code execution vulnerability exists in the way that Azure IoT Hub Device Client SDK using MQTT protocol accesses objects in memory. The vulnerability could corrupt memory in a way that could allow an attacker to execute arbitrary code in the context of the current user. An attacker who successfully exploited the vulnerability could gain the same user rights as the current user. If the current user is logged on with administrative user rights, the attacker could take control of an affected system. An attacker could then install programs; view, change, or delete data; or create new accounts with full user rights.

An attacker would have no way to force users to view the attacker-controlled content. Instead, an attacker would have to convince users to take action, typically via an enticement in email or instant message, or by getting them to open an email attachment.",remote code execution vulnerability,1
CVE-2018-7111,"A remote unauthorized access vulnerability was identified in HPE UIoT versions 1.5, 1.4.0, 1.4.1, 1.4.2, 1.2.4.2. Specifically, there is a malfunction identified in some section of the DSM portal and some DSM APIs. The impact of the malfunction is that the info can be changed by other users.",remote unauthorized access vulnerability,"HPE UIoT v- 1.5,1.4.0, 1.4.1, 1.4.2, 1.2.4.2 has a remote unauthorized data access vulnerability. Specifically, there is a malfunction identified in some section of the DSM portal and some DSM APIs. The impact of the malfunction is that the info can be changed by other users.",remote unauthorized data access vulnerability,3
CVE-2023-24819,"RIOT-OS, an operating system that supports Internet of Things devices, contains a network stack with the ability to process 6LoWPAN frames. Prior to version 2022.10, an attacker can send a crafted frame to the device resulting in an out of bounds write in the packet buffer. The overflow can be used to corrupt other packets and the allocator metadata. Corrupting a pointer will easily lead to denial of service. While carefully manipulating the allocator metadata gives an attacker the possibility to write data to arbitrary locations and thus execute arbitrary code. Version 2022.10 fixes this issue. As a workaround, disable support for fragmented IP datagrams or apply the patches manually.",out of bounds write in the packet buffer,RIOT-OS. < 2022.10. RIOT-OS contains a network stack with the ability to process 6LoWPAN frames. An attacker can send a crafted frame to the device resulting in an out of bounds write in the packet buffer. The overflow can be used to corrupt other packets and the allocator metadata. Corrupting a pointer will easily lead to denial of service. While carefully manipulating the allocator metadata gives an attacker the possibility to write data to arbitrary locations and thus execute arbitrary code.,out of bounds write in the packet buffer,1
CVE-2018-8479,"A spoofing vulnerability exists for the Azure IoT Device Provisioning for the C SDK library using the HTTP protocol on Windows platform, aka ""Azure IoT SDK Spoofing Vulnerability."" This affects C SDK.",spoofing vulnerability,"A spoofing vulnerability exists for the Azure IoT Device Provisioning for the C SDK library using the HTTP protocol on Windows platform. An attacker who successfully exploited this vulnerability could impersonate a server used during the provisioning process.

To exploit this vulnerability, an attacker would need to perform a man-in-the-middle (MitM) attack on the network that provisioning was taking place.

This security update addresses the vulnerability by correcting how the HTTP transport library validates certificates.

This vulnerability does NOT impact other Azure IoT SDK¡¯s such as Java/Node/C#, does NOT impact the C SDK when running on Linux or embedded OS¡¯s, and only impacts when using the HTTP transport and NOT MQTT or AMQP",spoofing vulnerability,1
CVE-2023-24821,"RIOT-OS, an operating system that supports Internet of Things devices, contains a network stack with the ability to process 6LoWPAN frames. Prior to version 2022.10, an attacker can send a crafted frame to the device resulting in a large out of bounds write beyond the packet buffer. The write will create a hard fault exception after reaching the last page of RAM. The hard fault is not handled and the system will be stuck until reset, thus the impact is denial of service. Version 2022.10 fixes this issue. As a workaround, disable support for fragmented IP datagrams or apply the patches manually.",a large out of bounds write beyond the packet buffer,RIOT-OS. < 2022.10. RIOT-OS contains a network stack with the ability to process 6LoWPAN frames. An attacker can send a crafted frame to the device resulting in a large out of bounds write beyond the packet buffer. The write will create a hard fault exception after reaching the last page of RAM. The hard fault is not handled and the system will be stuck until reset. Thus the impact is denial of service.,a large out of bounds write beyond the packet buffer,1
CVE-2021-21280,"Contiki-NG is an open-source, cross-platform operating system for internet of things devices. It is possible to cause an out-of-bounds write in versions of Contiki-NG prior to 4.6 when transmitting a 6LoWPAN packet with a chain of extension headers. Unfortunately, the written header is not checked to be within the available space, thereby making it possible to write outside the buffer. The problem has been patched in Contiki-NG 4.6. Users can apply the patch for this vulnerability out-of-band as a workaround.",out-of-bounds write,"Contiki-NG. < 4.6. It is possible to cause an out-of-bounds write in Contiki-NG when transmitting a 6LoWPAN packet with a chain of extension headers. Unfortunately, the written header is not checked to be within the available space, thereby making it possible to write outside the buffer.",out-of-bounds write,1
CVE-2014-9223,"Multiple buffer overflows in AllegroSoft RomPager, as used in Huawei Home Gateway products and other vendors and products, allow remote attackers to cause a denial of service or possibly execute arbitrary code via unspecified vectors related to authorization.",buffer overflows,"RomPager Authentication Security Bypass ¨CMisfortune Cookie: The vulnerability is due to an insecure design in the RomPager Server. Remote attacker could exploit this vulnerability to access the RomPager web-server under administrator privileges. 

RomPager Authorization Buffer-Overflow Denial of Service: A buffer-overflow vulnerability exist in RomPager Web Server. A remote attacker could exploit this vulnerability by sending a crafted request to the vulnerable server causing a denial of service.

Successful exploitation of this vulnerability may allow attackers to determine the ¡®fortune¡¯ of a request by manipulating cookies. Attackers can send specially crafted HTTP cookies that exploit the vulnerability to corrupt memory and alter the application state.",buffer-overflow vulnerability,2
CVE-2017-3193,Multiple D-Link devices including the DIR-850L firmware versions 1.14B07 and 2.07.B05 contain a stack-based buffer overflow vulnerability in the web administration interface HNAP service.,stack-based buffer overflow vulnerability,"D-Link DIR-850L, firmware versions 1.14B07, 2.07.B05, and possibly others, contains a stack-based buffer overflow vulnerability in the web administration interface HNAP service. Other models may also be affected. A remote, unauthenticated attacker can make a specially crafted POST request to gain arbitrary code execution as root.",stack-based buffer overflow vulnerability,1
CVE-2020-8861,This vulnerability allows network-adjacent attackers to bypass authentication on affected installations of D-Link DAP-1330 1.10B01 BETA Wi-Fi range extenders. Authentication is not required to exploit this vulnerability. The specific flaw exists within the handling of HNAP login requests. The issue results from the lack of proper handling of cookies. An attacker can leverage this vulnerability to execute arbitrary code on the router. Was ZDI-CAN-9554.,bypass authentication,Trend Micro's Zero Day Initiative (ZDI) research team submitted a HNAP Authentication Bypass Vulnerability that is  logic flaw in the implementation of the HNAP login algorithm allowing an attacker to bypass authentication and reset the admin password.,HNAP Authentication Bypass Vulnerability,3
,Trend Micro's Zero Day Initiative (ZDI) research team submitted a HNAP Authentication Bypass Vulnerability that is  logic flaw in the implementation of the HNAP login algorithm allowing an attacker to bypass authentication and reset the admin password.,HNAP Authentication Bypass Vulnerability,"D-Link. DAP-1330. This vulnerability allows network-adjacent attackers to bypass authentication on affected installations of D-Link DAP-1330 Wi-Fi range extenders. Authentication is not required to exploit this vulnerability.

The specific flaw exists within the handling of HNAP login requests. The issue results from the lack of proper handling of cookies. An attacker can leverage this vulnerability to execute arbitrary code on the router.",bypass authentication,3
,"D-Link. DAP-1330. This vulnerability allows network-adjacent attackers to bypass authentication on affected installations of D-Link DAP-1330 Wi-Fi range extenders. Authentication is not required to exploit this vulnerability.

The specific flaw exists within the handling of HNAP login requests. The issue results from the lack of proper handling of cookies. An attacker can leverage this vulnerability to execute arbitrary code on the router.",bypass authentication,This vulnerability allows network-adjacent attackers to bypass authentication on affected installations of D-Link DAP-1330 1.10B01 BETA Wi-Fi range extenders. Authentication is not required to exploit this vulnerability. The specific flaw exists within the handling of HNAP login requests. The issue results from the lack of proper handling of cookies. An attacker can leverage this vulnerability to execute arbitrary code on the router. Was ZDI-CAN-9554.,bypass authentication,1
CVE-2022-36233,"Tenda AC9 V15.03.2.13 is vulnerable to Buffer Overflow via httpd, form_fast_setting_wifi_set. httpd.",Buffer Overflow,Tenda AC9 firmware V15.03.2.13 httpd server has stack buffer overflow in form_fast_setting_wifi_set,stack buffer overflow,3
CVE-2013-7471,"An issue was discovered in soap.cgi?service=WANIPConn1 on D-Link DIR-845 before v1.02b03, DIR-600 before v2.17b01, DIR-645 before v1.04b11, DIR-300 rev. B, and DIR-865 devices. There is Command Injection via shell metacharacters in the NewInternalClient, NewExternalPort, or NewInternalPort element of a SOAP POST request.",Command Injection,"Different D-Link Routers are vulnerable to OS command injection in the UPnP SOAP interface. Since it is a blind OS command injection vulnerability, there is no output for the executed command when using the CMD target. Additionally, two targets are included, to start a telnetd service and establish a session over it, or deploy a native mipsel payload. This module has been tested successfully on DIR-300, DIR-600, DIR-645, DIR-845 and DIR-865. According to the vulnerability discoverer, more D-Link devices may affected.",blind OS command injection vulnerability,3
CVE-2020-10173,"Comtrend VR-3033 DE11-416SSG-C01_R02.A2pvI042j1.d26m devices have Multiple Authenticated Command Injection vulnerabilities via the ping and traceroute diagnostic pages, as demonstrated by shell metacharacters in the pingIpAddress parameter to ping.cgi.",Authenticated Command Injection vulnerabilities,"# Title: Comtrend VR-3033 - Authenticated Command Injection
# Date: 2020-02-26
# Author: Author : Raki Ben Hamouda
# Vendor: https://us.comtrend.com
# Product link: https://us.comtrend.com/products/vr-3030/
# CVE: CVE-2020-10173

The Comtrend VR-3033 is prone to Multiple Authenticated Command Injection
vulnerability via ping and traceroute diagnostic page.
Remote attackers are able to get full control and compromise the network
managed by the router.

Note : This bug may exist in other Comtrend routers .
===============================================
Product Page :
https://us.comtrend.com/products/vr-3030/

Firmware version :
DE11-416SSG-C01_R02.A2pvI042j1.d26m

Bootloader (CFE) Version :
 1.0.38-116.228-1

To reproduce the vulnerability attacker has to access the interface at
least with minimum privilege.",Authenticated Command Injection vulnerabilities,1
CVE-2020-12109,"Certain TP-Link devices allow Command Injection. This affects NC200 2.1.9 build 200225, NC210 1.0.9 build 200304, NC220 1.3.0 build 200304, NC230 1.3.0 build 200304, NC250 1.3.0 build 200304, NC260 1.5.2 build 200304, and NC450 1.5.3 build 200304.",Command Injection,"TP-LINK Cloud Cameras including products NC200, NC210, NC220, NC230, NC250, NC260, and NC450 suffer from a command injection vulnerability. The issue is located in the swSystemSetProductAliasCheck method of the ipcamera binary (Called when setting a new alias for the device via /setsysname.fcgi), where despite a check on the name length, no other checks are in place in order to prevent shell metacharacters from being introduced. The system name would then be used in swBonjourStartHTTP as part of a shell command where arbitrary commands could be injected and executed as root.",command injection vulnerability,3
,"TP-LINK Cloud Cameras including products NC200, NC210, NC220, NC230, NC250, NC260, and NC450 suffer from a command injection vulnerability. The issue is located in the swSystemSetProductAliasCheck method of the ipcamera binary (Called when setting a new alias for the device via /setsysname.fcgi), where despite a check on the name length, no other checks are in place in order to prevent shell metacharacters from being introduced. The system name would then be used in swBonjourStartHTTP as part of a shell command where arbitrary commands could be injected and executed as root.",command injection vulnerability,"TP-Link cloud cameras NCXXX series (NC200, NC210, NC220, NC230, NC250, NC260, NC450) are vulnerable to an authenticated command injection vulnerability. In all devices except NC210, despite a check on the name length in swSystemSetProductAliasCheck, no other checks are in place in order to prevent shell metacharacters from being introduced. The system name would then be used in swBonjourStartHTTP as part of a shell command where arbitrary commands could be injected and executed as root. NC210 devices cannot be exploited directly via /setsysname.cgi due to proper input validation. NC210 devices are still vulnerable since swBonjourStartHTTP did not perform any validation when reading the alias name from the configuration file. The configuration file can be written, and code execution can be achieved by combining this issue with CVE-2020-12110.",authenticated command injection vulnerability,3
,"TP-Link cloud cameras NCXXX series (NC200, NC210, NC220, NC230, NC250, NC260, NC450) are vulnerable to an authenticated command injection vulnerability. In all devices except NC210, despite a check on the name length in swSystemSetProductAliasCheck, no other checks are in place in order to prevent shell metacharacters from being introduced. The system name would then be used in swBonjourStartHTTP as part of a shell command where arbitrary commands could be injected and executed as root. NC210 devices cannot be exploited directly via /setsysname.cgi due to proper input validation. NC210 devices are still vulnerable since swBonjourStartHTTP did not perform any validation when reading the alias name from the configuration file. The configuration file can be written, and code execution can be achieved by combining this issue with CVE-2020-12110.",authenticated command injection vulnerability,"Certain TP-Link devices allow Command Injection. This affects NC200 2.1.9 build 200225, NC210 1.0.9 build 200304, NC220 1.3.0 build 200304, NC230 1.3.0 build 200304, NC250 1.3.0 build 200304, NC260 1.5.2 build 200304, and NC450 1.5.3 build 200304.",Command Injection,3
CVE-2020-13117,Wavlink WN575A4 and WN579X3 devices through 2020-05-15 allow unauthenticated remote users to inject commands via the key parameter in a login request.,inject commands,"Several Wavlink products are affected by a vulnerability that may allow remote unauthenticated users to execute arbitrary commands as root on Wavlink devices. The user input is not properly sanitized which allows command injection via the ""key"" parameter in a login request. It has been tested on Wavlink WN575A4 and WN579X3 devices, but other products may be affected.",command injection,2
CVE-2020-13782,D-Link DIR-865L Ax 1.20B01 Beta devices allow Command Injection.,Command Injection,"CVE-2020-13782: Improper Neutralization of Special Elements Used in a Command (Command Injection)
The web interface for this router is controlled by the backend engine called cgibin.exe. Most requests for web pages are sent to this controller. If a request for scandir.sgi is made, a malicious actor can inject arbitrary code to be executed on the router with administrative privileges.",Improper Neutralization of Special Elements Used in a Command (Command Injection),3
CVE-2020-15922,There is an OS Command Injection in Mida eFramework 2.9.0 that allows an attacker to achieve Remote Code Execution (RCE) with administrative (root) privileges. Authentication is required.,OS Command Injection,Mida eFramework version 2.8.9 suffers from a remote code execution vulnerability.,remote code execution vulnerability,4
,Mida eFramework version 2.8.9 suffers from a remote code execution vulnerability.,remote code execution vulnerability,"(Unauthenticated <= 2.8.9, Authenticated 2.9.0) There is an OS Command Injection in eFramework <= 2.8.9 that allows an attacker to trigger a Remote Code Execution (RCE), with administrative (root) privileges, through OS Command Injection. No authentication is required. The injection point resides on an undisclosed PHP page. Impact: OS Code Execution",OS Command Injection,4
,"(Unauthenticated <= 2.8.9, Authenticated 2.9.0) There is an OS Command Injection in eFramework <= 2.8.9 that allows an attacker to trigger a Remote Code Execution (RCE), with administrative (root) privileges, through OS Command Injection. No authentication is required. The injection point resides on an undisclosed PHP page. Impact: OS Code Execution",OS Command Injection,There is an OS Command Injection in Mida eFramework 2.9.0 that allows an attacker to achieve Remote Code Execution (RCE) with administrative (root) privileges. Authentication is required.,OS Command Injection,1
CVE-2020-16205,"Vendor: Geutebr¨¹ck
Equipment: G-Cam and G-Code
Vulnerability: OS Command Injection
Successful exploitation of this vulnerability could allow remote code execution as root.
Geutebruck reports the vulnerability affects firmware Versions 1.12.0.25 and prior as well as the limited Versions 1.12.13.2 and 1.12.14.5 of the following Encoder and E2 Series Camera models:
G-Code: 
EEC-2xxx
G-Cam: 
EBC-21xx
EFD-22xx
ETHC-22xx
EWPC-22xx
Using a specially crafted URL command, a remote authenticated user can execute commands as root.",OS Command Injection,"This Metasploit module exploits an authenticated arbitrary command execution vulnerability within the 'server' GET parameter of the /uapi-cgi/testaction.cgi page of Geutebruck G-Cam EEC-2xxx and G-Code EBC-21xx, EFD-22xx, ETHC-22xx, and EWPC-22xx devices running firmware versions <= 1.12.0.25 as well as firmware versions 1.12.13.2 and 1.12.14.5 when the 'type' GET parameter is set to 'ntp'. Successful exploitation results in remote code execution as the root user.",authenticated arbitrary command execution vulnerability,4
CVE-2020-17456,SEOWON INTECH SLC-130 And SLR-120S devices allow Remote Code Execution via the ipAddr parameter to the system_log.cgi page.,Remote Code Execution,"# Exploit Title: Seowon SLR-120 Router - Remote Code Execution (Unauthenticated)
# Date: 2022-03-11
# Exploit Author: Aryan Chehreghani
# Vendor Homepage: http://www.seowonintech.co.kr
# Software Link: http://www.seowonintech.co.kr/en/product/detail.asp?num=126&big_kind=B05&middle_kind=B05_30
# Version: All version
# Tested on: Windows 10 Enterprise x64 , Linux
# CVE : CVE-2020-17456

# [ About - Seowon SLR-120 router ]:

#The SLR-120 series are provide consistent access to LTE networks and transforms it to your own hotspot while being mobile,
#The convenience of sharing wireless internet access invigorates your lifestyle, families,
#friends and workmates. Carry it around to boost your active communication anywhere.

# [ Description ]:

#Execute commands without authentication as admin user ,
#To use it in all versions, we only enter the router ip & Port(if available) in the script and Execute commands with root user.

# [ Vulnerable products ]:

#SLR-120S42G
#SLR-120D42G
#SLR-120T42G
",Remote Code Execution (Unauthenticated),3
,"# Exploit Title: Seowon SLR-120 Router - Remote Code Execution (Unauthenticated)
# Date: 2022-03-11
# Exploit Author: Aryan Chehreghani
# Vendor Homepage: http://www.seowonintech.co.kr
# Software Link: http://www.seowonintech.co.kr/en/product/detail.asp?num=126&big_kind=B05&middle_kind=B05_30
# Version: All version
# Tested on: Windows 10 Enterprise x64 , Linux
# CVE : CVE-2020-17456

# [ About - Seowon SLR-120 router ]:

#The SLR-120 series are provide consistent access to LTE networks and transforms it to your own hotspot while being mobile,
#The convenience of sharing wireless internet access invigorates your lifestyle, families,
#friends and workmates. Carry it around to boost your active communication anywhere.

# [ Description ]:

#Execute commands without authentication as admin user ,
#To use it in all versions, we only enter the router ip & Port(if available) in the script and Execute commands with root user.

# [ Vulnerable products ]:

#SLR-120S42G
#SLR-120D42G
#SLR-120T42G
",Remote Code Execution (Unauthenticated),"Seowon SLR-120 RCE Exploit | Seowon SLR-120 - Remote Code Execution ( Unauthenticated ) | CVE-2020-17456

Vulnerable products : SLR-120S42G , SLR-120D42G , SLR-120T42G ( All Version )",Remote Code Execution ( Unauthenticated ),1
,"Seowon SLR-120 RCE Exploit | Seowon SLR-120 - Remote Code Execution ( Unauthenticated ) | CVE-2020-17456

Vulnerable products : SLR-120S42G , SLR-120D42G , SLR-120T42G ( All Version )",Remote Code Execution ( Unauthenticated ),SEOWON INTECH SLC-130 And SLR-120S devices allow Remote Code Execution via the ipAddr parameter to the system_log.cgi page.,Remote Code Execution,3
CVE-2020-24217,HiSilicon Video Encoder suffers from a remote code execution vulnerability via an unauthenticated upload of malicious firmware. Versions affected are vendor specific.,remote code execution vulnerability,HiSilicon Video Encoder suffers from a remote command injection vulnerability. Versions affected are vendor specific.,remote command injection vulnerability,4
CVE-2020-25506,"D-Link DNS-320 FW v2.06B01 Revision Ax is affected by command injection in the system_mgr.cgi component, which can lead to remote arbitrary code execution.",command injection,D-Link was made aware of a Command Injection Vulnerability report by Swing of Chaitin Security Research Lab affecting the D-Link Network Attached Storage (NAS): DNS-320 Revison Ax. ,Command Injection Vulnerability,3
CVE-2020-26919,NETGEAR JGS516PE devices before 2.6.0.43 are affected by lack of access control at the function level.,lack of access control at the function level,"NETGEAR has released fixes for a missing function level access control security vulnerability on the following product models:

JGS516PE, running firmware versions prior to 2.6.0.43",missing function level access control security vulnerability,2
CVE-2020-35665,An unauthenticated command-execution vulnerability exists in TerraMaster TOS through 4.2.06 via shell metacharacters in the Event parameter in include/makecvs.php during CSV creation.,unauthenticated command-execution vulnerability,"Name' => ""TerraMaster TOS 4.2.06 - Unauthenticated Remote Code Execution"",
      'Description' => %q(
        This module exploits a unauthenticated command execution vulnerability in TerraMaster TOS.
        The ""Event"" parameter in ""include/makecvs.php"" contains a vulnerability. 
        ""filename"" is executing command on system during "".csv"" creation. 
        In order to do this, it is not necessary to have a session in the application.
        Therefore an unathenticated user can execute the command on the system.
      )",unauthenticated command execution vulnerability,1
